{
  "schemaVersion": 1,
  "id": "builtin-core",
  "description": "Cross-mod moving-object policy.",
  "moving": {
    "modelNamespaces": {
      "include": [
        "copycats",
        "create_connected"
      ],
      "exclude": []
    },
    "features": {
      "create.chainConveyorAnimation": false,
      "create.mechanicalBeltAnimation": false,
      "simulated.ropeRendering": true,
      "simulated.springRendering": true,
      "simulated.coasterTrackRendering": true
    }
  },
  "rules": []
}
